<xs:schema xmlns:xs="http://www.w3.org/2001/XMLSchema">

    <xs:element name="data">
        <xs:complexType>
            <xs:sequence>
                <xs:element name="action" maxOccurs="unbounded">
                    <xs:complexType>
                        <xs:sequence>
                            <xs:element name="prompt" type="xs:string"/>
                            <xs:element name="parameter" minOccurs="0" maxOccurs="unbounded">
                                <xs:complexType>
                                    <xs:simpleContent>
                                        <xs:extension base="xs:string">
                                            <xs:attribute name="name" type="xs:string" use="required"/>
                                        </xs:extension>
                                    </xs:simpleContent>
                                </xs:complexType>
                            </xs:element>
                            <xs:element name="condition" minOccurs="0" maxOccurs="unbounded">
                                <xs:complexType>
                                    <xs:sequence>
                                        <xs:element name="blockMessage" type="xs:string" minOccurs="0"/>
                                        <xs:element name="script" type="xs:string"/>
                                    </xs:sequence>
                                </xs:complexType>
                            </xs:element>
                            <xs:element name="conditionShow" minOccurs="0"/>
                            <xs:element name="script" type="xs:string"/>
                        </xs:sequence>
                        <xs:attribute name="id" type="xs:string" use="required"/>
                        <xs:attribute name="actionPoints" type="xs:integer"/>
                    </xs:complexType>
                    <xs:unique name="uniqueParamName">
                        <xs:selector xpath="parameter"/>
                        <xs:field xpath="@name"/>
                    </xs:unique>
                </xs:element>
            </xs:sequence>
        </xs:complexType>
        <xs:unique name="uniqueID">
            <xs:selector xpath="action"/>
            <xs:field xpath="@id"/>
        </xs:unique>
    </xs:element>

</xs:schema>