<data xmlns:xsi="http://www.w3.org/2001/XMLSchema-instance" xsi:noNamespaceSchemaLocation="../schemas/actions.xsd">
    <action id="drive">
        <prompt>Drive</prompt>
        <parameter name="areaName">stat.parentArea.name</parameter>
        <script>
            var targetArea = stat.parentArea.noun;
            var vehicle = stat.parentObject.noun;
            sendSensoryEvent(phrase="driveTo", area=set(stat.subject.area.id, stat.parentArea.id), targetArea=targetArea, vehicle=vehicle);
            stat.parentObject.area = stat.parentArea.id;
        </script>
    </action>
    <action id="drive_corner">
        <prompt>Drive</prompt>
        <script>
            var targetArea = stat.parentArea.noun;
            var vehicle = stat.parentObject.noun;
            sendSensoryEvent(phrase="driveCorner", area=set(stat.subject.area.id, stat.parentArea.id), targetArea=targetArea, vehicle=vehicle);
            stat.parentObject.area = stat.parentArea.id;
        </script>
    </action>
</data>