<data xmlns:xsi="http://www.w3.org/2001/XMLSchema-instance" xsi:noNamespaceSchemaLocation="../schemas/actions.xsd">
    <action id="move_basic">
        <prompt>$areaName ($dir)</prompt>
        <parameter name="areaName">statHolder.parentArea.room != null &amp;&amp; (statHolder.subject.area.room == null || stat.subject.area.room.id != stat.parentArea.room.id) ? stat.parentArea.room.name : stat.parentArea.name</parameter>
        <script>
            var originAreaID = stat.subject.area.id;
            var targetArea = stat.parentArea.noun;
            sendSensoryEvent(area=set(originAreaID, stat.parentArea.id), phrase=stat.parentArea.move_phrase, targetArea=targetArea, dirName=dirName);
            stat.subject.area = stat.parentArea.id;
        </script>
    </action>
    <action id="move_corner">
        <prompt>$areaName (Around corner, $dir)</prompt>
        <script>
            var originAreaID = stat.subject.area.id;
            var targetArea = stat.parentArea.noun;
            sendSensoryEvent(area=originAreaID, phrase="moveCorner", targetArea=targetArea);
            stat.subject.area = stat.parentArea.id;
            sendSensoryEvent(area=stat.parentArea.id, phrase="moveCorner", detectSelf=false, targetArea=targetArea);
        </script>
    </action>
    <action id="move_door">
        <prompt>$areaName (Through $doorName, $dir)</prompt>
        <parameter name="doorName">stat.parentObject.name</parameter>
        <parameter name="areaName">statHolder.parentArea.room != null &amp;&amp; (statHolder.subject.area.room == null || stat.subject.area.room.id != stat.parentArea.room.id) ? stat.parentArea.room.name : stat.parentArea.name</parameter>
        <condition>
            <blockMessage>Locked</blockMessage>
            <script>stat.parentObject.locked == null || !stat.parentObject.locked</script>
        </condition>
        <script>
            var originAreaID = stat.subject.area.id;
            var targetArea = stat.parentArea.noun;
            var originRoomID = statHolder.subject.area.room != null ? stat.subject.area.room.id : null;
            var targetRoomID = statHolder.parentArea.room != null ? stat.parentArea.room.id : null;
            var originArea = originRoomID != null &amp;&amp; originRoomID != targetRoomID ? stat.subject.area.room.noun : stat.subject.area.noun;
            var door = stat.parentObject.noun;
            sendSensoryEvent(area=originAreaID, phrase="moveThrough", targetArea=targetArea, originArea=originArea, door=door);
            stat.subject.area = stat.parentArea.id;
            sendSensoryEvent(area=stat.parentArea.id, phrase="moveThroughReverse", detectSelf=false, targetArea=targetArea, originArea=originArea, door=door);
        </script>
    </action>
</data>